{
  "$schema": "https://json-schema.org/draft/2020-12/schema",
  "$id": "https://openauditmodel.org/schemas/profile-definition/0.1/schema.json",
  "title": "OpenAuditModel Profile Definition Schema",
  "description": "Structure of a declarative OpenAuditModel profile definition. This schema validates profile documents; it is NOT part of the canonical audit event schema and never constrains an audit event.",
  "$comment": "A profile may only add constraints. Nothing in this schema can relax, replace or reinterpret the core model: the rule vocabulary can require values to be present or equal, and can do nothing else. See decisions/0008-declarative-profile-conformance.md.",
  "type": "object",
  "additionalProperties": false,
  "required": [
    "profileVersion",
    "name",
    "version",
    "status",
    "coreVersions",
    "title",
    "description",
    "rules"
  ],
  "properties": {
    "profileVersion": {
      "description": "Version of the profile definition format this document uses.",
      "const": "0.1"
    },
    "name": {
      "description": "Profile identifier. Matches the directory the profile lives in.",
      "$ref": "#/$defs/token"
    },
    "version": {
      "description": "Version of this profile's rules, independent of the core specification version.",
      "type": "string",
      "minLength": 1,
      "maxLength": 32,
      "pattern": "^[0-9]+(\\.[0-9]+){0,2}$"
    },
    "status": {
      "description": "Maturity of the profile.",
      "enum": ["experimental", "stable", "deprecated"]
    },
    "coreVersions": {
      "description": "Core specification versions this profile applies to. An event declaring another `specVersion` is out of scope for the profile.",
      "type": "array",
      "minItems": 1,
      "maxItems": 16,
      "uniqueItems": true,
      "items": { "type": "string", "minLength": 1, "maxLength": 16 }
    },
    "title": { "$ref": "#/$defs/text" },
    "description": { "$ref": "#/$defs/text" },
    "rules": {
      "description": "Additional requirements. A rule applies only to the events its selector matches.",
      "type": "array",
      "minItems": 1,
      "maxItems": 256,
      "items": { "$ref": "#/$defs/rule" }
    }
  },
  "$defs": {
    "token": {
      "type": "string",
      "minLength": 1,
      "maxLength": 64,
      "pattern": "^[a-z][a-z0-9]*(-[a-z0-9]+)*$"
    },
    "text": {
      "type": "string",
      "minLength": 1,
      "maxLength": 1024
    },
    "ruleId": {
      "description": "Stable rule identifier, upper case and hyphen separated, such as IAM-ROLE-ASSIGN-001.",
      "type": "string",
      "minLength": 3,
      "maxLength": 64,
      "pattern": "^[A-Z][A-Z0-9]*(-[A-Z0-9]+){1,5}$"
    },
    "eventName": {
      "description": "Exact event name, using the core event naming rules.",
      "type": "string",
      "minLength": 3,
      "maxLength": 256,
      "pattern": "^[a-z][a-z0-9]*(-[a-z0-9]+)*(\\.[a-z][a-z0-9]*(-[a-z0-9]+)*)+$"
    },
    "eventPrefix": {
      "description": "Event name prefix, which MUST end with a dot so that `identity.role.` cannot accidentally match `identity.roles-export`.",
      "type": "string",
      "minLength": 2,
      "maxLength": 256,
      "pattern": "^[a-z][a-z0-9]*(-[a-z0-9]+)*(\\.[a-z][a-z0-9]*(-[a-z0-9]+)*)*\\.$"
    },
    "jsonPointer": {
      "description": "Non-empty JSON Pointer, as defined by RFC 6901.",
      "type": "string",
      "minLength": 2,
      "maxLength": 256,
      "pattern": "^(/([^~/]|~[01])*)+$"
    },
    "scalar": {
      "description": "Value a conditional or required-value constraint compares against. Scalars only: comparison is strict equality, never a structural match.",
      "type": ["string", "number", "boolean", "null"]
    },
    "condition": {
      "description": "The only conditional mechanism in v0.1: one path compared for equality against one scalar. There is no expression language, no boolean combination and no nesting.",
      "type": "object",
      "additionalProperties": false,
      "required": ["path", "equals"],
      "properties": {
        "path": {
          "description": "Absolute JSON Pointer into the event, such as /metadata/role/privileged.",
          "$ref": "#/$defs/jsonPointer"
        },
        "equals": { "$ref": "#/$defs/scalar" }
      }
    },
    "requiredValue": {
      "description": "A value that must be present and strictly equal to a scalar.",
      "type": "object",
      "additionalProperties": false,
      "required": ["path", "equals"],
      "properties": {
        "path": {
          "description": "Absolute JSON Pointer into the event, such as /authentication/mfa.",
          "$ref": "#/$defs/jsonPointer"
        },
        "equals": { "$ref": "#/$defs/scalar" }
      }
    },
    "requiredMetadata": {
      "description": "A field required under /metadata.",
      "type": "object",
      "additionalProperties": false,
      "required": ["path", "type"],
      "properties": {
        "path": {
          "description": "JSON Pointer RELATIVE to /metadata. `/role/id` means `/metadata/role/id`.",
          "$ref": "#/$defs/jsonPointer"
        },
        "type": {
          "description": "JSON type the value must have. Type checking only; profiles do not embed schema fragments in v0.1.",
          "enum": ["string", "number", "integer", "boolean", "object", "array"]
        }
      }
    },
    "rule": {
      "type": "object",
      "additionalProperties": false,
      "required": ["id", "description"],
      "anyOf": [{ "required": ["events"] }, { "required": ["eventPrefixes"] }],
      "properties": {
        "id": { "$ref": "#/$defs/ruleId" },
        "description": { "$ref": "#/$defs/text" },
        "rationale": {
          "description": "Why the requirement exists. Informative.",
          "$ref": "#/$defs/text"
        },
        "severity": {
          "description": "How a violation of this rule is reported. `error` fails conformance; `warning` and `info` do not. These values are the profile vocabulary and are unrelated to the privacy linter's severities.",
          "enum": ["info", "warning", "error"],
          "default": "error"
        },
        "events": {
          "description": "Exact event names this rule applies to.",
          "type": "array",
          "minItems": 1,
          "maxItems": 64,
          "uniqueItems": true,
          "items": { "$ref": "#/$defs/eventName" }
        },
        "eventPrefixes": {
          "description": "Event name prefixes this rule applies to.",
          "type": "array",
          "minItems": 1,
          "maxItems": 64,
          "uniqueItems": true,
          "items": { "$ref": "#/$defs/eventPrefix" }
        },
        "when": {
          "description": "Applies the rule's requirements only when this condition holds. When the condition path is absent, the condition does not hold and the rule contributes nothing.",
          "$ref": "#/$defs/condition"
        },
        "requiredPaths": {
          "description": "Absolute JSON Pointers that must resolve to a present value.",
          "type": "array",
          "minItems": 1,
          "maxItems": 64,
          "uniqueItems": true,
          "items": { "$ref": "#/$defs/jsonPointer" }
        },
        "requiredMetadata": {
          "description": "Fields required under /metadata, with their JSON type.",
          "type": "array",
          "minItems": 1,
          "maxItems": 64,
          "items": { "$ref": "#/$defs/requiredMetadata" }
        },
        "requiredValues": {
          "description": "Values required to be present and strictly equal to a scalar.",
          "type": "array",
          "minItems": 1,
          "maxItems": 64,
          "items": { "$ref": "#/$defs/requiredValue" }
        },
        "recommendedPaths": {
          "description": "Absolute JSON Pointers that SHOULD resolve to a present value. Absence produces a warning and never fails conformance.",
          "type": "array",
          "minItems": 1,
          "maxItems": 64,
          "uniqueItems": true,
          "items": { "$ref": "#/$defs/jsonPointer" }
        }
      }
    }
  }
}
